{
  "$schema": "http://json-schema.org/draft-07/schema#",
  "$ref": "#/definitions/Bait",
  "definitions": {
    "Bait": {
      "type": "object",
      "properties": {
        "id": {
          "type": "string"
        },
        "name": {
          "type": "string"
        },
        "description": {
          "type": "string"
        },
        "rarity": {
          "type": "number"
        },
        "craft": {
          "type": "object",
          "properties": {
            "items": {
              "type": "array",
              "items": {
                "type": "object",
                "properties": {
                  "id": {
                    "type": "string"
                  },
                  "name": {
                    "type": "string"
                  },
                  "amount": {
                    "type": "number"
                  }
                },
                "required": [
                  "id",
                  "name",
                  "amount"
                ],
                "additionalProperties": false
              }
            },
            "result": {
              "type": "number"
            },
            "version": {
              "type": "string"
            }
          },
          "required": [
            "items",
            "result"
          ],
          "additionalProperties": false
        },
        "fish": {
          "type": "array",
          "items": {
            "type": "object",
            "properties": {
              "id": {
                "type": "string"
              },
              "name": {
                "type": "string"
              },
              "rarity": {
                "type": "number"
              }
            },
            "required": [
              "id",
              "name",
              "rarity"
            ],
            "additionalProperties": false
          }
        },
        "version": {
          "type": "string"
        }
      },
      "required": [
        "id",
        "name",
        "description",
        "rarity",
        "craft",
        "fish"
      ],
      "additionalProperties": false
    }
  }
}