{
  "id": "FruitPasteBait",
  "name": "果釀餌",
  "description": "十分常見的魚餌，由日落果與小麥搗碎發酵揉製而成，入水後能夠快速霧化，對小型魚類有著強烈的吸引力。由於其製作簡單、價格低廉、效用優秀，因此又被戲稱為「釣魚佬寶珠」。<br/><br/>適用魚種：鱂魚類。",
  "rarity": 2,
  "craft": {
    "items": [
      {
        
        "id": "Sunsettia",
        "name": "日落果",
        "amount": 1
      },
      {
        
        "id": "Wheat",
        "name": "小麥",
        "amount": 1
      }
    ],
    "result": 10
  },
  "fish": [
    {
      
      "id": "AizenMedaka",
      "name": "藍染花鱂",
      "rarity": 3
    },
    {
      
      "id": "Crystalfish",
      "name": "水晶宴",
      "rarity": 3
    },
    {
      
      "id": "Dawncatcher",
      "name": "擒霞客",
      "rarity": 3
    },
    {
      
      "id": "GlazeMedaka",
      "name": "琉璃花鱂",
      "rarity": 3
    },
    {
      
      "id": "Medaka",
      "name": "花鱂",
      "rarity": 3
    },
    {
      
      "id": "SweetflowerMedaka",
      "name": "甜甜花鱂",
      "rarity": 3
    }
  ]
}