{
	"id": "FakeFlyBait",
	"name": "Mồi Ruồi Giả",
	"description": "Mồi câu mô phỏng theo hình thù ruồi nhặng, được làm từ các nguyên liệu có màu sắc sặc sỡ, không mùi, là mồi câu đặc biệt dành cho các loại cá lớn có thị giác linh hoạt, thông thường sẽ phối hợp với cách câu cá tương đối khó hơn. Hội Câu Cá ở một số nơi còn dùng Mồi Ruồi Giả để làm một trong các tiêu chuẩn tăng cấp cán bộ.Loại cá thích hợp: Cá Rồng, Cá Pháo, Cá Đuối.",
	"rarity": 2,
	"craft": {
		"items": [
			{
				"id": "SakuraBloom",
				"name": "Tú Cầu Anh Đào",
				"amount": 1
			},
			{
				"id": "Horsetail",
				"name": "Đuôi Ngựa",
				"amount": 1
			}
		],
		"result": 10
	},
	"fish": [
		{
			"id": "BitterPufferfish",
			"name": "Cá Pháo Cay Đắng",
			"rarity": 3
		},
		{
			"id": "GoldenKoi",
			"name": "Cá Rồng Xích Kim",
			"rarity": 3
		},
		{
			"id": "Pufferfish",
			"name": "Cá Pháo",
			"rarity": 3
		},
		{
			"id": "RustyKoi",
			"name": "Cá Rồng Thép",
			"rarity": 3
		},
		{
			"id": "DivdaRay",
			"name": "Cá Đuối Divda",
			"rarity": 3
		},
		{
			"id": "FormaloRay",
			"name": "Cá Đuối Formalo",
			"rarity": 3
		}
	]
}
